{
  "$schema": "https://json-schema.org/draft/2020-12/schema",
  "$id": "https://vineyard.run/schemas/registry/typepack-entry/1.0.0.json",
  "title": "Vineyard registry typepack entry",
  "description": "One row in community-typepacks.json. Symmetric with the plugin entry. Typepacks carry no scopes (no code executes); 'categories' drives the facet filter.",
  "type": "object",
  "additionalProperties": false,
  "required": ["identifier", "content_type", "name", "author", "description", "repo", "ref", "path"],
  "properties": {
    "identifier": { "type": "string", "pattern": "^(?:[a-z0-9]+(?:-[a-z0-9]+)*\\.){2,}typepacks\\.[a-z0-9]+(?:[._-][a-z0-9]+)*$", "description": "Reverse-DNS PK; equals typepack.identifier. The namespace is the AUTHOR'S OWN reverse-DNS prefix, two labels or more: `run.vineyard.*` is first-party, a third party publishes under its own (`com.acme.*`, `io.github.someone.*`). Claiming a namespace you do not control is a review question, not a schema one." },
    "content_type": { "const": "vineyard:typepack" },
    "name": { "type": "string", "minLength": 1, "maxLength": 128 },
    "author": { "type": "string", "minLength": 1 },
    "description": { "type": "string", "minLength": 1, "maxLength": 250 },
    "repo": { "type": "string", "pattern": "^[^/]+/[^/]+$" },
    "ref": { "type": "string", "pattern": "^([0-9a-f]{40}|[0-9a-f]{64})$", "description": "IMMUTABLE commit SHA (40-hex SHA-1 or 64-hex SHA-256) of the content repo, captured at PR time. Tags/branches are mutable and REJECTED - pin the exact reviewed commit. Human-readable release is in `version`." },
    "path": { "type": "string", "description": "Path to the typepack JSON within repo@ref." },
    "version": { "type": "string", "pattern": "^(0|[1-9]\\d*)\\.(0|[1-9]\\d*)\\.(0|[1-9]\\d*)$" },
    "categories": {
      "type": "array",
      "uniqueItems": true,
      "items": { "type": "string", "pattern": "^[a-z][a-z0-9_]*$" },
      "description": "DERIVED: distinct types[].category values; drives the category facet."
    },
    "type_count": { "type": "integer", "minimum": 1, "description": "DERIVED: types[].length." },
    "icon": { "type": "string", "pattern": "^[a-z][a-z0-9]*(?:-[a-z0-9]+)*$", "description": "DERIVED: types[0].icon when it is a kebab-case lucide icon name. Omitted otherwise (an image URI or glyph is not carried)." },
    "thumbnail_url": { "type": "string", "format": "uri" },
    "verified": { "type": "boolean", "default": false, "description": "DERIVED: set by build_registry.py from verified-authors.json — true when the identifier's namespace is claimed by the handle in `author`. Never read from the submission; a value typed here is discarded." },
    "status": {
      "type": "object",
      "additionalProperties": false,
      "required": ["state", "reason", "since"],
      "properties": {
        "state": {
          "enum": ["deprecated", "withdrawn"],
          "description": "`deprecated`: still safe, still loads, no longer recommended. `withdrawn`: must not load — for a type pack that means every node typed by it renders untyped, so withdraw one only when its content is gone or wrong, never merely to retire it."
        },
        "reason": {
          "type": "string",
          "minLength": 10,
          "maxLength": 300,
          "description": "Shown verbatim to an analyst who has this pack installed. Write it for them, not for the registry: what happened and what to do."
        },
        "since": { "type": "string", "pattern": "^\\d{4}-\\d{2}-\\d{2}$", "description": "Date of the delisting, YYYY-MM-DD." },
        "replacement": {
          "type": "string",
          "pattern": "^(?:[a-z0-9]+(?:-[a-z0-9]+)*\\.){2,}typepacks\\.[a-z0-9]+(?:[._-][a-z0-9]+)*$",
          "description": "Where users should go instead. Must be a live pack of the same kind in this catalog."
        }
      },
      "description": "Present only on a DELISTED entry. The row stays in the catalog on purpose — deleting it takes the pack off the browse page but tells an already-installed client nothing, which is the one audience that needs to hear. See SPEC.md §7."
    }
  }
}
