{
  "identifier": "run.vineyard.typepacks.geo",
  "content_type": "vineyard:typepack",
  "name": "Geospatial",
  "author": "VINEYARD",
  "description": "Places and physical context — locations with coordinates, postal addresses, and facilities — to anchor the 'where' of an investigation.",
  "repo": "Vineyard-Intelligence/typepack-basic",
  "ref": "d80c8badd50e9c74a84638d4113149216d7e2619",
  "path": "typepacks/geo.json",
  "version": "1.0.0",
  "categories": [
    "geo"
  ],
  "type_count": 3,
  "icon": "map-pin"
}
