{
  "identifier": "run.vineyard.typepacks.telegram",
  "content_type": "vineyard:typepack",
  "name": "Telegram",
  "author": "VINEYARD",
  "description": "Telegram entities collected without joining: accounts (people and bots), broadcast channels, supergroups, and their posts. Pairs with the Telegram plugin pack.",
  "repo": "Vineyard-Intelligence/typepack-telegram",
  "ref": "4259b13e055e18e64b8171602731f9ca5c89474f",
  "path": "typepacks/telegram.json",
  "version": "1.5.1",
  "categories": [
    "telegram"
  ],
  "type_count": 4,
  "icon": "user"
}
