{
  "identifier": "run.vineyard.typepacks.endpoint",
  "content_type": "vineyard:typepack",
  "name": "Endpoint",
  "author": "VINEYARD",
  "description": "Host and endpoint forensic artifacts (files, processes, registry keys, services, mutexes, scheduled tasks) for DFIR and malware-behavior mapping.",
  "repo": "Vineyard-Intelligence/typepack-basic",
  "ref": "9aaf78ced69636a24d7b461551661e9b18abae89",
  "path": "typepacks/endpoint.json",
  "version": "1.1.0",
  "categories": [
    "endpoint"
  ],
  "type_count": 6,
  "icon": "file-text"
}
