[
  {
    "identifier": "run.vineyard.typepacks.endpoint",
    "content_type": "vineyard:typepack",
    "name": "Endpoint",
    "author": "VINEYARD",
    "description": "Host and endpoint forensic artifacts (files, processes, registry keys, services, mutexes, scheduled tasks) for DFIR and malware-behavior mapping.",
    "repo": "Vineyard-Intelligence/typepack-basic",
    "ref": "9aaf78ced69636a24d7b461551661e9b18abae89",
    "path": "typepacks/endpoint.json",
    "version": "1.1.0",
    "categories": [
      "endpoint"
    ],
    "type_count": 6,
    "icon": "file-text",
    "verified": true
  },
  {
    "identifier": "run.vineyard.typepacks.financial",
    "content_type": "vineyard:typepack",
    "name": "Financial",
    "author": "VINEYARD",
    "description": "Follow-the-money entities: cryptocurrency addresses and transactions, exchanges, and bank accounts. Public identifiers only — no keys, PANs, or credentials.",
    "repo": "Vineyard-Intelligence/typepack-basic",
    "ref": "d80c8badd50e9c74a84638d4113149216d7e2619",
    "path": "typepacks/financial.json",
    "version": "1.0.0",
    "categories": [
      "financial"
    ],
    "type_count": 4,
    "icon": "wallet",
    "verified": true
  },
  {
    "identifier": "run.vineyard.typepacks.geo",
    "content_type": "vineyard:typepack",
    "name": "Geospatial",
    "author": "VINEYARD",
    "description": "Places and physical context — locations with coordinates, postal addresses, and facilities — to anchor the 'where' of an investigation.",
    "repo": "Vineyard-Intelligence/typepack-basic",
    "ref": "d80c8badd50e9c74a84638d4113149216d7e2619",
    "path": "typepacks/geo.json",
    "version": "1.0.0",
    "categories": [
      "geo"
    ],
    "type_count": 3,
    "icon": "map-pin",
    "verified": true
  },
  {
    "identifier": "run.vineyard.typepacks.identity",
    "content_type": "vineyard:typepack",
    "name": "Identity",
    "author": "VINEYARD",
    "description": "People, organizations, and the identities that connect them - personas, email addresses, phone numbers, PGP keys, and the accounts they hold on websites.",
    "repo": "Vineyard-Intelligence/typepack-basic",
    "ref": "effd3937add7e893d14914ef652e86bd38e883c2",
    "path": "typepacks/identity.json",
    "version": "2.2.1",
    "categories": [
      "identity"
    ],
    "type_count": 7,
    "icon": "user",
    "verified": true
  },
  {
    "identifier": "run.vineyard.typepacks.infrastructure",
    "content_type": "vineyard:typepack",
    "name": "Infrastructure",
    "author": "VINEYARD",
    "description": "Network-infrastructure and web OSINT entities (IPs, domains, URLs, hosts, ASNs, netblocks, DNS/WHOIS records, TLS certificates, SSH host keys, technologies, web fingerprints and tracking/ad-account identifiers) and their relationships.",
    "repo": "Vineyard-Intelligence/typepack-basic",
    "ref": "2e6dc6f762709dbc8a460a5ad5ad2417c86fe6cb",
    "path": "typepacks/infrastructure.json",
    "version": "4.0.0",
    "categories": [
      "infrastructure",
      "web"
    ],
    "type_count": 15,
    "icon": "network",
    "verified": true
  },
  {
    "identifier": "run.vineyard.typepacks.social",
    "content_type": "vineyard:typepack",
    "name": "Social Media",
    "author": "VINEYARD",
    "description": "Platform-agnostic social media entities - accounts, posts, hashtags, groups, and media - with a platform discriminator on every entity. Attribution to a person or organization stays in the Identity pack.",
    "repo": "Vineyard-Intelligence/typepack-social",
    "ref": "32287ccee6d162f08f35cfc25057e50680662f21",
    "path": "typepacks/social.json",
    "version": "1.1.0",
    "categories": [
      "social"
    ],
    "type_count": 5,
    "icon": "at-sign",
    "verified": true
  },
  {
    "identifier": "run.vineyard.typepacks.telegram",
    "content_type": "vineyard:typepack",
    "name": "Telegram",
    "author": "VINEYARD",
    "description": "Telegram entities collected without joining: accounts (people and bots), broadcast channels, supergroups, and their posts. Pairs with the Telegram plugin pack and its tgpeek gateway.",
    "repo": "Vineyard-Intelligence/typepack-telegram",
    "ref": "f05808b8320f45e958f8df7a43a182c756320d17",
    "path": "typepacks/telegram.json",
    "version": "1.5.0",
    "categories": [
      "telegram"
    ],
    "type_count": 4,
    "icon": "user",
    "verified": true
  },
  {
    "identifier": "run.vineyard.typepacks.threat",
    "content_type": "vineyard:typepack",
    "name": "Threat",
    "author": "VINEYARD",
    "description": "Threat-intelligence entities (malware, campaigns, operations, vulnerabilities, threat actors, indicators, attack patterns, tools, detection signatures) and their relationships, aligned with STIX 2.1.",
    "repo": "Vineyard-Intelligence/typepack-basic",
    "ref": "9a1bd524fc162b6d1d6e8bf0d543c761e8742969",
    "path": "typepacks/threat.json",
    "version": "1.4.0",
    "categories": [
      "threat"
    ],
    "type_count": 10,
    "icon": "bug",
    "verified": true
  }
]
